assay_id	assay_name	assay_type	target_analytes	detection_method	detection_limit	dynamic_range	protocol_reference	equipment_required	sample_preparation	data_output_format	Download URL	source
OBI:TRL-001	Time-Resolved Lanthanide Luminescence Assay	time-resolved luminescence (TRL)	Eu3+, Tb3+	f-f transition luminescence with time-gating	0.1 nM	0.1 nM - 10 μM	Protocol_TRL_v1	Fluorescence plate reader with time-resolved detection	Cell lysis, dilution to assay buffer	Luminescence intensity (RLU) vs. time	https://www.protocols.io/view/lanthanide-trl-assay	extend1
OBI:ICP-001	ICP-OES Lanthanide Quantification	ICP-OES	La, Ce, Pr, Nd, Eu, Gd, Tb	Optical emission spectroscopy	1 ppb	1 ppb - 100 ppm	EPA Method 200.7	ICP-OES spectrometer, argon supply	Acid digestion (HNO3), dilution	Element concentrations (mg/L)	https://www.epa.gov/esam/method-2007-determination-metals-and-trace-elements-water-and-wastes-inductively-coupled	extend1
OBI:FACS-001	High-REE Binding Cell Sorting	FACS	Europium-bound cells	Europium luminescence gating	Single cell	10^3 - 10^7 cells	Protocol_FACS_v1	Flow cytometer with 355 nm excitation	Eu3+ incubation, wash, resuspension	Sorted cell populations (FCS files)	https://www.protocols.io/view/facs-ree-binding	extend1
Custom_FACS_from_fmicb-14-1258452	FACS assay from fmicb-14-1258452	FACS		flow cytometry			See fmicb-14-1258452 Methods section					10.3389/fmicb.2023.1258452
Custom_ICP-MS_from_fmicb-13-921635	ICP-MS assay from fmicb-13-921635	ICP-MS		ICP-MS			See fmicb-13-921635 Methods section					10.3389/fmicb.2022.921635
